LINK,Title,Location,Salary,Summary
https://kr.indeed.com/viewjob?jk=c58d20943e9dce58,테크니컬 오디오 디자이너(Technical Audio Designer)...,엔씨소프트 2.7 성남 판교역,,"4 활용 능력 - Protools, Reaper 등의 DAW 활용 능력 - 스크립팅 언어 활용 능력 ( Python, Lua, R 등) - 커뮤니케이션 능력 우대사항 - Wwise 자격증 보유 (101, 201, 251..."
https://kr.indeed.com/viewjob?jk=1748baa27965fdbf,"MVP 개발 엔지니어(서버, 웹프론트) (정규직, 계약직, 프리랜서)",더테스터 대전 중구,,1년 이상의 서버 개발 경험 · 아래 옵션 중 하나의 기술 스택 사용 - JAVA기반의 Spring - Python 기반의 Django - Ruby 기반의 Rails 우대사항 · 팀단위로 프로젝트를 수주해본 적 있는...
https://kr.indeed.com/viewjob?jk=f4190a8dbb8c05b1,[AI R&D] Language AI(NLP) Research 분야 수시...,엔씨소프트 2.7 성남 판교역,,"분 - 통계/Machine Learning에 대한 이해와 활용 능력 및 text 처리 기술에 대한 경험 - Python, Java 등을 이용하여 NLP 기술을 구현 가능한 분 - 최신 기술(논문, 기술문서 등)을 습득하는..."
https://kr.indeed.com/viewjob?jk=57ad151ff89a3275,Engineering Manager - EdgeX - IoT,Canonical - Jobs 서울,,"engineer Significant programming experience in C, Golang, Python, or like languages A solid understanding... makeup..."
https://kr.indeed.com/viewjob?jk=cac18e6bcbee5a21,Front end 개발자,브릭 성남 분당구,"연봉 28,000,000원","ElasticSearch 사용 언어 (빈도수 순) : Java, C#, Javascript, Scala, Python, R, C++ 7. 근무 조건 근무장소 : 경기도 성남시 분당구 판교역로 230, 309호(삼환하이펙스..."
https://kr.indeed.com/viewjob?jk=7c19ff88836f8869,고등광기술연구소 전문연구요원,광주과학기술원 광주 북구,,"고출력 펄스형/극초단 광섬유 레이저, 레이저/고암섬유 레이저, 레이저 인공지능 융합연구, matlab/ python/ FPGA / Raspberry Pi 등 (경험자 우대) 우대사항 ① 국가보훈대상자(취업보호대상자) 및..."
https://kr.indeed.com/viewjob?jk=d56db98820a1324c,스크립트 개발 프로그래머,Nexon 성남 분당구,,"류하여 함께 도전해나갈 분들을 기다리고 있습니다. [주요업무] - JavaScript 및 기타(Lua, Python) 스크립트 엔진 연동, 프로젝트에 맞게 수정 및 최적화 - MOD-CORE 개발시 필요한 스크립팅 개발..."
https://kr.indeed.com/viewjob?jk=e5621bcf506c9148,협동로봇 실습장비 개발 및 교육 인력 /로봇공학 기술자 및 연구원,씨엔로봇 대전 중구,"연봉 28,000,000원 - 30,000,000원","활용 교직원 연수 - 실습장비 활용 학생 연수 - 실습장비 납품 후 활용 교육 ㅇ 협동로봇 티칭 및 교육 - Python, ROS, C# 등 프로그래밍 및 교육 - PLC, HMI 프로그래밍 및 교육 상세모집요강 접수기간..."
https://kr.indeed.com/viewjob?jk=02f450f1246c5489,[서울지사][던파모바일2D] 서버 빌드 담당자,네오플 서울 강남구,,"C/C++ 사용이 능숙하신 분 우대사항 - DevOps 관련 경험 - 하나 이상의 스크립트 언어 ( Python, PowerShell, Bash, Groovy… )에 능숙하신 분 - Windows/Linux 서버 운영체제에..."
https://kr.indeed.com/viewjob?jk=96688eea9c1a9e28,Security Engineer (취약점 분석),Toss 서울 강남구,,"# 자격 요건 - 모의해킹 및 취약점 점검 경력이 있는 분 - 소스 코드 정적 취약점 점검에 능숙한 분 - Python, C, C++, JAVA 중 프로그래밍 언어에 능숙한 분 # 우대 사항 - 국내 또는 국외 버그 바운티..."
https://kr.indeed.com/viewjob?jk=b4c6146c52b4dc2b,(주)테라젠바이오 데이터과제팀 계약직,테라젠바이오 수원 영통구,,"등 한 가지 이상의 Back-end Framework 경험 - Git 등의 협업 툴 사용 우대사항: - Python 사용 경험 - Linux 숙련자 - 컨테이너(Docker, k8s), 클라우드 경험 0 명 근무조건 고용형태..."
https://kr.indeed.com/viewjob?jk=85e44b7572a7c332,[카카오 클라우드] 카카오 분산 기술 플랫폼 개발자 모집,카카오 4.0 성남 판교역,,"및 운영 신규 플랫폼 발굴 및 개발 지원자격 개발 경력 2년 이상 Linux환경에서 C/C++, Go, Python 등 언어 중 하나 이상 가능하신 분 협업 및 커뮤니케이션이 원활한 분 시스템 운영에 책임감이 있으신 분..."
https://kr.indeed.com/viewjob?jk=20d40ee61adffeca,챗봇 플랫폼 개발자 모집,카카오 4.0 성남 판교역,,"서비스에 대한 두려움이 없으신 분 서버 개발 Java, Scala, Kotlin 등의 JVM 기반 언어 및 Python을 이용해서 실서비스 개발 및 운영해보신 분 데이터 엔지니어 Kafka, Elasticsearch..."
https://kr.indeed.com/viewjob?jk=18ed6f92a291d134,Sr. Manager for Logistics digital transf...,Thermo Fisher Scientific 3.5 서울,,"Excel (VBA, power pivots) skills - Experience in R studio, Python, data modeling, and hypothesis testing is a plus - Must..."
https://kr.indeed.com/viewjob?jk=1b62babbbf2d717a,경험최적화 - 데이터 사이언티스트/분석가,Nexon 성남 분당구,,피처 탐색 등) - 게임 내 행동 패턴 로그 분석과 패턴 식별 및 이를 통한 서비스 개선 지원자격 - Python을 사용한 데이터 분석 및 모델 개발 경험 - 머신러닝 라이브러리 활용 경험 - 셀프 모티베이션과 원활한...
https://kr.indeed.com/viewjob?jk=481f953ccaa4bc96,머신러닝 개발자 모집,넷마블 서울 구로구,,"시스템 운영 효율화 및 고도화 자격요건 - ML 관련 분야 경력 6년 이상 - Cloud 서비스 활용 경험 - Python, C/C++, SQL 사용 가능 - Tensorflow 또는 상응하는 라이브러리 활용 경험 우대사항..."
https://kr.indeed.com/viewjob?jk=7d4bc2a107c6669b,Customer Engineer,Microsoft 4.2 서울,,least 5 years welcome experience in model development using python or R. Experience in migrating from one database to another...
https://kr.indeed.com/viewjob?jk=36c48cb9bc2758cb,매칭 기획,Nexon 성남 분당구,,"경험이 있다면 더 좋습니다. - 확률 및 통계에 대한 기본적인 지식이 있다면 더 좋습니다. - SQL, Python 등을 사용해 기초적인 데이터 분석, 머신러닝 등을 다루는 데에 관심이 있으면 더 좋습니다. - FIFA..."
https://kr.indeed.com/viewjob?jk=0b05f7fff851371a,게임 런처 개발,Nexon 성남 분당구,,르고 안정적으로 게임을 실행할 수 있도록 함께 고민하고 개발하실 분을 찾습니다. 지원자격 - C++ 혹은 Python 프로그래밍 언어 능숙자 - 비동기 및 병렬처리 프로그래밍 경험 우대사항 - Modern C++ (11...
https://kr.indeed.com/viewjob?jk=489f19028e8a723b,통합인터페이스 백엔드 서버 개발,Nexon 성남 분당구,,"게임 빅데이터 실시간 처리 시스템 개발 지원자격 - 백엔드 서버 개발 경력 3년 이상 - Java, Python, Javascript 중 1개 이상의 프로그래밍 경험 - HTTP API 설계 및 개발 경험 - MSA..."
https://kr.indeed.com/viewjob?jk=6fe5311eacbea17a,데이터 인프라 담당자 모집,카카오 4.0 성남 판교역,,"어링 5년 이상 업무 경험 보유자 하둡 에코시스템 기반 대용량 데이터의 수집, 가공이 가능한 분 Java, python, go, bash 등 언어 중 하나 이상 활용 가능하신 분 #우대사항 데이터 분석가, 머신러닝 전문가..."
https://kr.indeed.com/viewjob?jk=54e0d08c99dcf507,MI(Market Intelligence)담당 마케팅 전략 경력사원,LG전자 3.8 서울 영등포구,,"마케팅 전략/방향성 도출 경험 보유 4) 우대 사항 - 통계 분석 및 프로그래밍 언어 역량 보유: R, python, Java, SPSS, Tableau, etc. - 영어 능통 역량: 해외법인과 영어 화상 회의 및 현지..."
https://kr.indeed.com/viewjob?jk=2238a8f7a38080f3,리서치분야 경력직,케이지제로인 대한민국,,"모델링 자격 요건 - 금융공학, 경영학(재무학), 경제학, 수학 등 관련 분야 전공자 - SQL, R, Python 등 Tool 숙련자 우대사항 - 금융관련 자격증 소지자 / 재무 및 통계 관련 석박사 / 펀드 관련..."
https://kr.indeed.com/viewjob?jk=6b86ea39985912b6,NHN Cloud 사업기획/영업,NHN 4.4 성남 판교역,,"Linux, Microsoft Solutions 등) - 2년 이상의 개발 경험 (Java, Python 등) - 기술 문서 작성 및 가이드 경험이 풍부한 자 - 대외 고객 기술 지원 경험 공통지원자격..."
https://kr.indeed.com/viewjob?jk=a22173d071050949,NLP Engineer for AI Startup (remote),MIND AI 서울 • 원격 근무,"연봉 40,000,000원 - 60,000,000원","field. * 3+ years programming experience, 2+ years in Python especially in teams. * Thorough understanding of programming..."
https://kr.indeed.com/viewjob?jk=a6d9692dec21424c,[아이콘트롤스] 2020년 경력 직원 (기술연구소) 연구개발부문,현대산업개발 3.0 성남 분당구,,"3년 이상 - 프로그램 개발( Python, Java) 능력 보유 - 대용량... 이상 -오픈소스 기반 백엔드 개발자 -Spring, node.js, python 프레임워크를 활용한 서버 개발 역량 -AWS를 활용한 개발 유경험자..."
