LINK,Title,Location,Salary,Summary
https://kr.indeed.com/viewjob?jk=da5c549bf1a76ded,데이터 사이언스(데이터 모델링 및 추천 모델링),NHN 4.4 성남 판교역,,"AB테스트, 결과 해석 등) - 리눅스 환경에서 머신 러닝 및 데이터 분석 관련 언어, 라이브러리( Python, R, SQL, tensorflow 등) 능숙한 활용 - 머신러닝, 추천 , 딥러닝 관련 논문을..."
https://kr.indeed.com/viewjob?jk=3929f9c03665e38e,Credit Risk Manager,Toss 서울 강남구,,"장상황 및 변화에 대한 전략적/분석적 능력을 보유하신 분 - SAS, SQL, KnowlegeSEEKER, Python, R 등 Tool사용이 가능하신 분 - 원활한 커뮤니케이션 가능하신 분 # 우대 사항 - 신용대출/신용카..."
https://kr.indeed.com/viewjob?jk=18ed6f92a291d134,Sr. Manager for Logistics digital transf...,Thermo Fisher Scientific 3.5 서울,,"Excel (VBA, power pivots) skills - Experience in R studio, Python, data modeling, and hypothesis testing is a plus - Must..."
https://kr.indeed.com/viewjob?jk=447e5726f229a2b7,"Cloud Technical Solutions Engineer, Netw...",Google 4.3 서울,,"reading or debugging code (e.g., Java, C, C++, .NET, Python, Shell, Perl, JavaScript). Experience advocating for customer..."
https://kr.indeed.com/viewjob?jk=07375dc4e800dfa9,추천 시스템 소프트웨어 엔지니어,카카오 4.0 성남 판교역,,"관련 업무 경험자 우대사항 운영체제, 네트워크, 컴파일러, 데이터베이스에 대한 이해가 깊으신 분 Python, C++, GPU 프로그래밍 숙련자 대용량/실시간 서비스 개발/운영 경험이 많으신 분 ICPC/TopCoder..."
https://kr.indeed.com/viewjob?jk=b40a553df450c1b4,[데이타게이트 코리아] IT지원 기술자/개발자,데이타게이트코리아 서울 구로구,,Platform 사용 경험자 ㆍApache OSS(Open Source Software) 사용 경험자 ㆍJava/ Python 개발 경험자 0 명 근무조건 고용형태: 정규직(수습기간3개월) 근무부서: 솔루션사업팀 인근전철역...
https://kr.indeed.com/viewjob?jk=14076e1efa25f8da,그린뉴딜분야 연계형 교육 참여,사단법인 한국벰스협회 서울 구로구,,게임>빅데이터·AI(인공지능)> Python|인터넷·IT·통신·모바일·게임... 로그래머>증강현실(AR)|인터넷·IT·통신·모바일·게임>응용프로그래머> Python|인터넷·IT·통신·모바일·게임>응용프로그래머>머신러닝(ML)|인터넷...
https://kr.indeed.com/viewjob?jk=74d66a601cc8dde0,DBA,Toss 서울 강남구,,DBA 3년 이상) 경험 있으신 분 - SQL을 숙련되게 다루시는 분 - Shell 운영 스크립트 개발이 가능하신 분 # 우대 사항 - NoSQL (MongoDB) 운영경험이 있는 분 - Python 개발이 가능하신 분
https://kr.indeed.com/viewjob?jk=ae5283196d38f489,"영상처리, 머신비전, 장비제어 비전센터 상반기 공개",유토시스 경기도 화성,,"응용 S/W개발 -. 운영/제어 개발 [자격요건] -. 학력 : 대졸이상 -. MFC, C++, C# 또는 Python 경험자 -. Windows기반 UI 프로그램 개발 경험자 -. 영상처리 알고리즘 개발 경험자 -. 검사장..."
https://kr.indeed.com/viewjob?jk=724d638053bd85bb,"IOT인공지능 융합메이커 강사 훈련생 (코딩, 아두이노, 3D모델링 등)",동대문여성인력개발센터 서울 동대문구,,통신·모바일·게임>빅데이터·AI(인공지능)>데이터분석|인터넷·IT·통신·모바일·게임>빅데이터·AI(인공지능)> Python|인터넷·IT·통신·모바일·게임>빅데이터·AI(인공지능)>머신러닝|인터넷·IT·통신·모바일·게임>빅데이터...
https://kr.indeed.com/viewjob?jk=bd5ce1a809ec610a,Modem QA Contractor,聯發科技 경기도 성남,,4. Good verbal and written communication skills in English 5. Prefer programing experience(C/JAVA/ Python #LI-NOPOST
https://kr.indeed.com/viewjob?jk=be95b5718905880f,AI/빅데이터/클라우드 분야 (인재 Pool),LG유플러스 3.8 서울,,"Science를 위한 언어(R/ Python) 및 Tool(scikit-learn/Tensorflow 등) 능숙자 . Deep Learning Model 구현 경험자 . Java, Python등을 이용하여 분석을 위한 Data..."
https://kr.indeed.com/viewjob?jk=eaee1538d8cc832f,메시지발송 플랫폼 개발자,Nexon 성남 분당구,,"개발 가능하면서 python 개발 경험 소유자(또는 Python 개발 가능... NET 또는 python 개발 경력 5년이상 - 자동화를 위한 스크립트(powershell, bash, python 등) 경험 - Windows..."
https://kr.indeed.com/viewjob?jk=bfe0f5ac4f32ec89,추천 통계분석/데이터사이언티스트,카카오 4.0 성남 판교역,,"또는 통계, 수학 관련 분야의 석사 및 박사 학위 소지자 숙련된 데이터분석 능력 데이터 사이언스를 위한 언어( Python/R) 를 하나 이상 능숙하게 다룰 수 있으신 분 분석 결과를 설득력있게 전달할 수 있는 분 우대사항..."
https://kr.indeed.com/viewjob?jk=acf452118fce4b26,웹개발자,곳간 서울 강남구,"연봉 34,000,000원 - 36,000,000원","지원자격 ㆍ경력 : 경력 3년 이상 ㆍPHP, javascript, HTML, MySQL, TCP/IP, Python ㆍDB분석 및 기본설계 능력있으신 분 우대사항 ㆍ커머스, 플랫폼 개발실무 경험자 ㆍ자유롭게 아이디어를 내고..."
https://kr.indeed.com/viewjob?jk=f97d8d627c3d7362,Infra Software Engineer,Toss 서울 강남구,,"분 - Software-intensive system의 구조 설계 경험이 있는 분 - C, Golang, Python, Javascript 중 하나 이상의 언어에 능숙하신 분 # 우대 사항 - 다양한 기반 기술에 대한 이해도..."
https://kr.indeed.com/viewjob?jk=9819ba37f864cc20,프로그래머 (어플리케이션 개발자 또는 웹개발자),오너클랜 서울 금천구,,인터넷·IT·통신·모바일·게임>응용프로그래머>자바스크립트|인터넷·IT·통신·모바일·게임>응용프로그래머> Python|인터넷·IT·통신·모바일·게임>응용프로그래머>C#|인터넷·IT·통신·모바일·게임>웹프로그래머>웹개발|인터넷...
https://kr.indeed.com/viewjob?jk=f014d6c9744121e1,Security Engineer - Ubuntu,Canonical - Jobs 서울,,"new systems and techniques quickly You are skilled in C, Python, and other programming languages You can develop automated..."
https://kr.indeed.com/viewjob?jk=b86fa42793152db8,[Search] 클라우드 컴퓨팅 플랫폼 BE 개발 신입/경력사원,네이버 서울,,위한 기술 제안 [자격요건] · CS 관련 탄탄한 기본기를 바탕으로 습득이 빠르신 분 · Java / Python / C / C++ 중 1 개 이상의 언어로 개발 가능 · 리눅스 환경에서의 개발 경험 · 우수한 문제 분석...
https://kr.indeed.com/viewjob?jk=97b032faeb4b1bd1,연구소 개발부문 연구원 직원 (회로설계/하드웨어설계/머신비전/이미지프로세...,모든 경기도 광명,"연봉 42,000,000원 - 46,000,000원","프로그래밍 가능자 우대 S/W 설계 부문 : - OPEN CV, TENSORFLOW, YOLO, CUDA/ Python, C++, C WindowsGUL APL, MFC Lib 활용 가능자. 머신비전/ 영상처리 개발자 * 전기..."
https://kr.indeed.com/viewjob?jk=e157aa3d21a2a1be,대학경쟁력연구원 연구직계약직원(계약직),아주대학교 3.8 수원 영통구,,"원자격  필수사항 : 석사학위 또는 박사학위 소지자  우대사항 - 데이터 분석 관련 전공자 - R, Python, SQL, Excel 등을 이용한 데이터 분석 가능자 - 시각화 툴 사용능력 및 정량적/정성적 분석..."
https://kr.indeed.com/viewjob?jk=5efc4afdac9d87aa,AI/딥러닝기반 머신비전 비전센터 상반기 공개,유토시스 경기도 화성,,"상처리응용S/W -. 딥러닝 모델링 [자격요건] -. 학력 : 대졸이상 -. MFC, C++, C# 또는 Python 경험자 -. 딥러닝 알고리즘 개발 경험자 -. 국내/외 출장 가능자 [우대사항] -. 수학/물리/통계/컴퓨..."
https://kr.indeed.com/viewjob?jk=cfc6c4d6a4cd83bd,Senior Analyst - Data Analytics,McKinsey & Company 4.3 서울,,"skills with python, R Knowledge... suited... business problem (using Python, SAS, SQL, R and other relevant tools..."
https://kr.indeed.com/viewjob?jk=05a8e481d9859e2c,"고등광기술연구소 레이저응용시스템연구실 박사후연구원, 위촉연구원",광주과학기술원 광주 북구,,"공지능 융합연구 (Matlab/ python, Labview/ FPGA... 연구/개발 2. 레이저/포토닉스-인공지능 융합연구 (Matlab/ python, Labview/ FPGA/ Raspberry Pi 등 경험자..."
https://kr.indeed.com/viewjob?jk=2238a8f7a38080f3,리서치분야 경력직,케이지제로인 대한민국,,"모델링 자격 요건 - 금융공학, 경영학(재무학), 경제학, 수학 등 관련 분야 전공자 - SQL, R, Python 등 Tool 숙련자 우대사항 - 금융관련 자격증 소지자 / 재무 및 통계 관련 석박사 / 펀드 관련..."
https://kr.indeed.com/viewjob?jk=092d062a6faa7139,데이터 분석가 모집,카카오 4.0 성남 판교역,,"이터 분석 지원자격 데이터 분석 업무를 수행할 수 있는 하나 이상의 언어 스킬 필수 (예. SQL, Python, R 등) 데이터 기반 프로젝트 경험이 있으신 분 (예: 통계 분석 프로젝트) 어떤 일이라도 중요하게 여기..."
https://kr.indeed.com/viewjob?jk=b03599413eff0e3d,웹 개발 및 서버 인프라 담당자,이든 서울 송파구,"연봉 28,000,000원 - 30,000,000원","ㆍ클라우드 인프라 관리 및 서비스 아키텍처 설계 운영 ㆍ네트워크 및 시스템 모니터링 자격요건 ㆍJava, Python, GoLang, PHP 중 하나이상의 언어 경험자 ㆍ서버 네트워크에 대한 이해 ㆍ학력 : 학력무관 ㆍ경력..."
https://kr.indeed.com/viewjob?jk=90e77f4d6043c724,데이터 분석가,스포카 부산 해운대구 +1 지역,,"성을 주도적으로 제시할 수 있는 분을 찾습니다. 우대 사항 1가지 이상의 프로그래밍 언어를 구사하시는 분: Python, R 등의 프로그래밍 언어를 1개 이상 능숙하게 사용 가능하신 분이면 좋습니다. 데이터 웨어하우징 인프라..."
https://kr.indeed.com/viewjob?jk=f611a72cc9b1761e,CTO 혁신추진실 AID팀 Machine Learning&AI 정규직,이투스교육 서울 강남구,,"구축 지원자격 ﻿일반적인 Back-end 시스템 설계 및 개발 ML/AI 시스템 아키텍쳐 설계 경험 Python, scala, R 등 ML 및 통계 관련 언어 사용 경험 머신러닝 프레임워크 경험자 (TensorFlow..."
https://kr.indeed.com/viewjob?jk=9e8bab2ecbb48d29,"웹개발, 백엔드 외 신입/경력 계약직",뚜껑 서귀포 서귀포시,,통신·모바일·게임>웹프로그래머>백엔드|인터넷·IT·통신·모바일·게임>웹프로그래머>프론트엔드|인터넷·IT·통신·모바일·게임>웹프로그래머> Python|인터넷·IT·통신·모바일·게임>웹프로그래머>HTML·DHTML·mHTML
https://kr.indeed.com/viewjob?jk=9e1861e691426a98,Field AI Engineer,Graphcore 서울,,"hardware acceleration technologies Experience with Python and C++... depth knowledge of computer architectures, high..."
https://kr.indeed.com/viewjob?jk=80dea8b8353c3ee0,System Engineer,Toss 서울 강남구,,"# 자격 요건 - Linux 환경에서 대용량 TPS 운영 경험이 있으신 분 - 스크립트 언어(shell, python, Perl, Ruby 등)를 사용하여 인프라 운영이 가능하신 분 - HTTP, TCP/IP 프로토콜에 대한..."
https://kr.indeed.com/viewjob?jk=7c19ff88836f8869,고등광기술연구소 전문연구요원,광주과학기술원 광주 북구,,"고출력 펄스형/극초단 광섬유 레이저, 레이저/고암섬유 레이저, 레이저 인공지능 융합연구, matlab/ python/ FPGA / Raspberry Pi 등 (경험자 우대) 우대사항 ① 국가보훈대상자(취업보호대상자) 및..."
https://kr.indeed.com/viewjob?jk=094f2d843194ea1f,AppArmor Security Engineer,Canonical - Jobs 서울,,"grasp of Linux security technologies You are skilled in C, Python, and other programming languages You have experience..."
https://kr.indeed.com/viewjob?jk=46975ee759c13b8a,데이터 분석/처리 플랫폼 개발,NHN 4.4 성남 판교역,,"데이터 수집, 처리 및 지표 분석 경험 - 데이터 기반의 문제해결 역량 및 논리적 사고 - Java, Python, Scala 중 최소 1가지 언어를 이용한 데이터 분석 및 소프트웨어 개발 역량 - 통계분석..."
https://kr.indeed.com/viewjob?jk=a22173d071050949,NLP Engineer for AI Startup (remote),MIND AI 서울 • 원격 근무,"연봉 40,000,000원 - 60,000,000원","field. * 3+ years programming experience, 2+ years in Python especially in teams. * Thorough understanding of programming..."
https://kr.indeed.com/viewjob?jk=da280e20451ce755,Integration Engineer,스트라드비젼 서울 강남구,"연봉 40,000,000원 - 50,000,000원","algorithm • (Preferred) Experience of variant script language ( Python, Shell) • (Preferred) Experience of Linux build system..."
https://kr.indeed.com/viewjob?jk=cbec3e35c0a250c5,[경력] 웹 프로그램 개발자 - ITS,삼정 KPMG 3.3 서울 강남구,,"MS-SQL을 활용한 개발 경험 - Power BI, SQL Server Reporting Services, python 등 다양한 개발환경에 관심이 많은 자 4. 우대사항 - Classic ASP를 활용한 개발 경험..."
https://kr.indeed.com/viewjob?jk=13ead4619b06cd88,[한화테크윈]SW 개발 경력 채용,한화그룹 4.2 서울,,"Machine Learning/Deep Learning(Caffe, TensorFlow, Pytorch, Python, C/C++, Docker) - Feature extraction, low-level Image..."
https://kr.indeed.com/viewjob?jk=941687b6bbb14d81,웹 개발자 경력 Java/Php/Javascript/Python/Html...,바이오브레인 대전 서구,"연봉 30,000,000원 - 35,000,000원","(주)바이오브레인 웹 개발자 경력 채용 모집부문 및 자격요건 담당업무 자격요건 인원 [담당업무] ㆍ웹 기반 프로젝트 개발 및 운영 [근무부서 및 직급/직책] 직급/직책: 대리 [자격요건] ㆍJava, Php..."
https://kr.indeed.com/viewjob?jk=beaf31828719882c,[공통기술부문] AI / ML 엔지니어 (3년 이상),우아한 형제들 서울 송파구,,"수정할 수 있는 분 - 3년 이상의 실무 경험, 1개 이상의 ""숙련된"" 프로그래밍 언어 활용 능력(ex. Python, C++ 등)을 가진 분 - 원천 데이터를 탐색, 검증, 취합하는 단계부터 모델의 구현, 학습, 배포까지..."
https://kr.indeed.com/viewjob?jk=a24eee6864638bc4,Data Engineer,IBM 3.9 서울,,"Competitive products Deep skills on Data Warehouse, ETL, Python, Java and related algorithms. Expert Level – SQL, NoSQL..."
https://kr.indeed.com/viewjob?jk=e8477fb56aa56c85,"Site Reliability Engineer, APAC",Canonical - Jobs 서울,,maintaining enterprise open-source software solutions Python software development experience... large projects Strong...
https://kr.indeed.com/viewjob?jk=b574f1454ae36aab,Cross Border Ecommerce - Business Intell...,Shopee 서울,,business analyst related roles Proficient in SQL and Python Strong analytical skill and sensitivity to data Strong oral...
https://kr.indeed.com/viewjob?jk=dbe3257e487e5814,[AI/Lab] AI 백엔드 엔지니어 (전문연구요원 가능),버즈니 서울,,"플랫폼 및 시스템 구축 이런 분을 찾습니다 주도적으로 문제를 찾고, 해결할 수 있는 능력을 보유하신 분 Python 사용 경험이 있으신 분 다음 항목 중 두 가지 이상에 해당되는 분 AWS 혹은 GCP와 같은 클라우드 플랫폼..."
https://kr.indeed.com/viewjob?jk=661a80939b1acd30,Solutions Engineer,f5 서울,,"Kubernetes) • Proficient in one or more programming languages ( Python, JavaScript, Golang, etc.) What you’ll bring: • 5 +..."
https://kr.indeed.com/viewjob?jk=c39d18040425ef53,PostgreSQL 운영 및 데이터베이스 관리자 모집,카카오 4.0 성남 판교역,,"청하고 잘 이해하는 분 Database 운영 유경험자 ( PostgreSQL 운영 경험이 있으신 분 우대) python, go, bash 등 개발 경험이 있는 분 우대 클라우드 환경의 DB시스템 구축 및 운영 경험이 있는 분..."
https://kr.indeed.com/viewjob?jk=4910d33b5b470a5f,[Clova CIC] AI/ML 개발 인턴사원,네이버 서울,,"대한 기본 지식 - PyTorch나 Tensorflow와 같은 딥러닝 프레임워크에 대한 지식 및 개발 경험 - Python을 사용한 소프트웨어 개발 경험 우대사항 - 컴퓨터과학, 컴퓨터 엔지니어링, 수학 및 관련 분야 전공..."
https://kr.indeed.com/viewjob?jk=5d4ef5faadd96b30,"[대성] 개발자 채용 | 앱개발,Java,Python,objective",대성 관심기업 전주 팔복동,,"근무조건 정규직 급여 면접후 결정 주 5일 | 오전 9시~오후 6시 undefined 전북전체, 전북 전주시 지원자격 신입, 경력 무관, 경력무관 학력무관 우대조건 해당업무 인턴경험, 해당업무 근무경험, 컴퓨터활용 우수..."
https://kr.indeed.com/viewjob?jk=166aa0c72e94a266,Business Data Analyst,Soomgo 서울 강남구,,"즈니스에 적용하고 개선한 경험 (Google Optimize, Optimizely, 등) 우대사항 • Python 또는 R 을 사용하여 데이터 분석에 활용 가능 • 경영학, 통계학, 경제학, data analysis 등..."
https://kr.indeed.com/viewjob?jk=9819ba37f864cc20,프로그래머 (어플리케이션 개발자 또는 웹개발자),오너클랜 서울 금천구,,인터넷·IT·통신·모바일·게임>응용프로그래머>자바스크립트|인터넷·IT·통신·모바일·게임>응용프로그래머> Python|인터넷·IT·통신·모바일·게임>응용프로그래머>C#|인터넷·IT·통신·모바일·게임>웹프로그래머>웹개발|인터넷...
https://kr.indeed.com/viewjob?jk=5427e21e463b7e42,[TmaxTibero/기술] DBMS 제품 QA 신입 및 경력,티맥스소프트 성남 분당구,,"스트 시나리오 기획/작성, 테스트 및 관리 - 품질관리 시스템 개발 및 유지보수 자격요건 - Java/C/ Python 초급 개발자/경험자 - Unix/Linux 엔지니어 경험자 - IT 관련 학과 4년 대졸자 또는 졸업 예정..."
https://kr.indeed.com/viewjob?jk=3d5f8e364a71247e,Software Engineer (Back-end),Streami 서울,"연봉 35,000,000원 - 80,000,000원","Experience in JavaScript, Python or Java... one of: Modern Javascript, Java, Python * Experience building and maintaining..."
https://kr.indeed.com/viewjob?jk=3933762f9f06df56,Data Scientist(CSS 모델링),Toss 서울 강남구,,"3년 이상) - 머신러닝 등 최신 알고리즘을 활용하여 실제 비즈니스 문제 해결 경험이 있으신 분 - SQL, Python, R 등 통계/분석 프로그램을 다룰 수 있으신 분 # 우대 사항 - 금융권 데이터 분석 및 모델링 업무..."
https://kr.indeed.com/viewjob?jk=8b950c3f1114b37b,[Clova CIC] AI/ML 개발자 (경력),네이버 서울,,"대한 기본 지식 - PyTorch나 Tensorflow와 같은 딥러닝 프레임워크에 대한 지식 및 개발 경험 - Python을 사용한 소프트웨어 개발 경험 우대사항 - 컴퓨터과학, 컴퓨터 엔지니어링, 수학 및 관련 분야 전공..."
https://kr.indeed.com/viewjob?jk=86940003c157ab95,[정보보안] 보안기반 분석 개발 담당자 모집,엔씨소프트 2.7 성남 판교역,,"이기종 보안시스템의 운영업무 자동화 개발 지원자격 학력 : 무관 경력기간 : 2년 ~ 10년 필수조건 - Python 프로그래밍 언어로 개발이 가능하며, 오픈소스를 활용한 개발이 가능한 분 - 보안솔루션의 동작 원리와 연동..."
https://kr.indeed.com/viewjob?jk=3e80435be74cd28f,블록체인인터넷경제연구센터 위촉연구원,광주과학기술원 광주 북구,,업무) 지원자격 연구직 O명 블록체인 연구 및 프로그래밍 제작 1) SW프로그래밍 제작 경험자 2) Python/C/Java/Go 프로그래밍 가능자 3) 블록체인 개발 경험자 우대 4) 컴퓨터공학 및 컴퓨터사이...
https://kr.indeed.com/viewjob?jk=74cf47be676133ff,DGIST 미래자동차융합연구센터 계약직 연구원 및 연수연구원 공개 초빙...,대구경북과학기술원 대구 현풍면,,"기술개발 우대 사항 우대사항 - S/W개발능력, C,C++, Python,Matlab 등 능숙자 - 자율주행 및 ADAS관련 프로젝트 참여경... W개발능력, C,C++, Python,Matlab 등 능숙자 - 자율주행..."
https://kr.indeed.com/viewjob?jk=e8316d85fa013062,[TGD] 플랫폼 서비스 Back-End 프로그래머 모집,엔씨소프트 2.7 성남 판교역,,"Spring Framework(Spring Boot)을 이용한 Application 개발 경험자 2. Python, Javascript 등의 스크립트 활용 능력 3. DB설계 및 SQL 지식 4. 최신 기술 동향에 능동적인..."
https://kr.indeed.com/viewjob?jk=05a8e481d9859e2c,"고등광기술연구소 레이저응용시스템연구실 박사후연구원, 위촉연구원",광주과학기술원 광주 북구,,"공지능 융합연구 (Matlab/ python, Labview/ FPGA... 연구/개발 2. 레이저/포토닉스-인공지능 융합연구 (Matlab/ python, Labview/ FPGA/ Raspberry Pi 등 경험자..."
https://kr.indeed.com/viewjob?jk=9a818d9d91db847d,Data Analytics SA,Amazon Web Services Korea LLC 서울,,"some relevant languages, tools and frameworks (e.g python, Java, R, scala, spark, Kafka, Hadoop ecosystem, presto, Hive..."
https://kr.indeed.com/viewjob?jk=09dc6e4abecbd481,인공지능 교육 컨텐츠 제작자,에이쳐 용인 처인구,,교육컨텐츠 제작 [필요사항] - 학사 이상 - 인공지능 관련 기술에 대한 관심 또는 경험 [우대사항] - Python / Tensorflow / C / C++ / HTML5 / CSS / Java / Javascript 등...
https://kr.indeed.com/viewjob?jk=a1db36bb69f67c6f,[카카오 클라우드] 대용량 분산 스토리지 개발자 모집,카카오 4.0 성남 판교역,,쓰레드 기반 네트워크 프로그래밍 경험이 있으신 분 Go 언어로 프로덕션 레벨의 문제 해결 경험이 있으신 분 Python 등의 스크립트 언어를 하나 이상 다룰 수 있으신 분 HBase 등의 NoSQL 시스템 운영이나 사용 경험...
https://kr.indeed.com/viewjob?jk=2892c67308e87f01,Field Data Scientist,Success Korea 경기도,,"Scripting experience required (e.g. Matlab, R, Python). Familiarity with analytics... e.g. Matlab, R, Python). Familiarity..."
https://kr.indeed.com/viewjob?jk=724d638053bd85bb,"IOT인공지능 융합메이커 강사 훈련생 (코딩, 아두이노, 3D모델링 등)",동대문여성인력개발센터 서울 동대문구,,통신·모바일·게임>빅데이터·AI(인공지능)>데이터분석|인터넷·IT·통신·모바일·게임>빅데이터·AI(인공지능)> Python|인터넷·IT·통신·모바일·게임>빅데이터·AI(인공지능)>머신러닝|인터넷·IT·통신·모바일·게임>빅데이터...
https://kr.indeed.com/viewjob?jk=df21e3bb5d773616,Python Programmer,Mofac 서울 서초구,,개발 – JAVA 프로그래밍(라이브러리 활용) – Spring 프레임 워크 개발 – Python API 프로그래밍 우대사항 – Python 개발 경험 – Open Source 라이브러리 개발경험 – Web 표준에 대한 경험...
https://kr.indeed.com/viewjob?jk=27ea6faf6a8516fd,퀀트 개발자 (Quant Developer),ATZ Inc. 서울,"연봉 30,000,000원 - 40,000,000원",any... following languages. (C/C++/C#/ Python/Java/Node.js)* Experience with R... languages) C/C++/C#/ Python/Java R/Excel...
https://kr.indeed.com/viewjob?jk=b8c6ad4bd3f32e3d,AI 개발자,넷아이디 서울 강남구,"연봉 35,000,000원 - 40,000,000원",인터넷·IT·통신·모바일·게임>응용프로그래머>머신러닝(ML)|인터넷·IT·통신·모바일·게임>응용프로그래머> Python|인터넷·IT·통신·모바일·게임>ERP·시스템분석·설계>인공지능(AI)서비스기획|인터넷·IT·통신·모바일...
https://kr.indeed.com/viewjob?jk=fb3395b4ba6b4f61,SW Engineer for R&D Extension Korea,Applied Materials Inc. 경기도 화성,,"engineer with C, C++, C#, Java, MATLAB, SQL data base, Python, Excel Macro, etc. c. Experience in multidisciplinary..."
https://kr.indeed.com/viewjob?jk=7af6301dc691d3ab,Data Scientist,Toss 서울 강남구,,"실무 경험 5년 이상 갖추신 분 - 실제 서비스 데이터를 이용한 분석모델 개발 경험이 있으신 분 - R, Python, Scala, SQL 등 데이터 분석의 업무를 수행할 수 있는 하나 이상의 개발 언어에 능숙하신 분 #..."
https://kr.indeed.com/viewjob?jk=377b958b50cd3c98,"[신입,경력] Application 개발자",유즈브레인넷 서울 구로구,,"담당업무 자격요건 인원 MFC/Visual C++ [담당업무] - application - C, C++ - Python - 헬스케어 제품 어플 개발 - APP(iOS/Android) - 응용프로그래머 [근무부서 및 직급/직책..."
https://kr.indeed.com/viewjob?jk=98c2229e57d4ee1f,전기전자컴퓨터공학부(바이오컴퓨팅연구실) 위촉연구원,광주과학기술원 광주 북구,,"국가보훈대상자(취업보호대상자) 및 장애인은 관련 법령에 의거하여 우대 ② 컴퓨터 프로그램밍 (Matlab, Python, C++등) 가능자 ③ 뇌파 측정 및 분석 2년 이상 경력 ➃ 딥러닝 기술 개발 경험 결격사유..."
https://kr.indeed.com/viewjob?jk=4910d33b5b470a5f,[Clova CIC] AI/ML 개발 인턴사원,네이버 서울,,"대한 기본 지식 - PyTorch나 Tensorflow와 같은 딥러닝 프레임워크에 대한 지식 및 개발 경험 - Python을 사용한 소프트웨어 개발 경험 우대사항 - 컴퓨터과학, 컴퓨터 엔지니어링, 수학 및 관련 분야 전공..."
https://kr.indeed.com/viewjob?jk=e1c3d69e4d47c07b,[진행중]우리은행 마이데이터ACT 전문직 (데이터 사이언티스트(데이터 기...,우리은행 4.5 서울 회현동,,"3년 이상 경험 보유자 - 전산/수학/통계 또는 관련 분야 석사 이상 학위 소지자 - 데이터 분석 언어( Python, R 등) 사용 업무 경험 보유자 급여수준 및 채용조건 급여수준 : 면접 후 협의 계약형태..."
